{
  "characters": [
    {
      "name": "林小满",
      "nn": 1,
      "tier": "lead",
      "speaks": true,
      "evidence": [
        "抱着病历夹从尽头走来",
        "护士"
      ],
      "derived": [
        "29 岁左右夜班护士"
      ],
      "proposal": [
        "右眉一道小疤（认脸用）"
      ],
      "anchors": [
        "黑色低马尾",
        "右眉一道小疤",
        "浅蓝护士服白色工牌",
        "细长脖子"
      ],
      "variants": [
        {
          "label": "夜班",
          "kind": "base",
          "age": "29",
          "face_hair": "黑色低马尾，瓜子脸",
          "marks": "右眉一道小疤",
          "costume": "浅蓝护士服，白色工牌，白鞋",
          "lock_card": [
            "黑色低马尾",
            "右眉一道小疤",
            "瓜子脸",
            "细长脖子",
            "浅蓝护士服",
            "白色工牌别在左胸",
            "白色护士鞋",
            "无首饰"
          ],
          "sheet": "素材库/人物/林小满_三视图.png",
          "crops": [
            "素材库/人物/林小满_特写.png",
            "素材库/人物/林小满_全身正面.png",
            "素材库/人物/林小满_全身侧面.png"
          ],
          "voice": "素材库/声音/林小满.wav",
          "voice_short": "素材库/声音/林小满_短.wav",
          "checked": true
        }
      ],
      "voice_profile": {
        "age_feel": "二十八九",
        "timbre": "清而薄，略带鼻音",
        "line_quality": "画内近场",
        "pace": "偏快",
        "breath": "紧张时尾音发颤",
        "mood": "守规矩的克制"
      }
    },
    {
      "name": "周岸",
      "nn": 2,
      "tier": "lead",
      "speaks": true,
      "evidence": [
        "穿着病号服外面套了件黑夹克",
        "前夫"
      ],
      "derived": [
        "33 岁左右"
      ],
      "anchors": [
        "寸头",
        "左耳后一颗痣",
        "黑夹克套在蓝白条病号服外",
        "左袖口可被划开"
      ],
      "variants": [
        {
          "label": "病号服黑夹克",
          "kind": "base",
          "age": "33",
          "face_hair": "寸头，方下巴",
          "marks": "左耳后一颗痣",
          "costume": "蓝白条病号服外套黑色夹克，拖鞋",
          "lock_card": [
            "寸头",
            "方下巴",
            "左耳后一颗痣",
            "蓝白条病号服",
            "黑色尼龙夹克",
            "灰色拖鞋",
            "右手腕留置针贴膏",
            "无眼镜"
          ],
          "sheet": "素材库/人物/周岸_三视图.png",
          "crops": [
            "素材库/人物/周岸_特写.png",
            "素材库/人物/周岸_全身正面.png",
            "素材库/人物/周岸_全身侧面.png"
          ],
          "voice": "素材库/声音/周岸.wav",
          "checked": true
        }
      ],
      "voice_profile": {
        "age_feel": "三十出头",
        "timbre": "低、沉、颗粒感",
        "line_quality": "画内近场",
        "pace": "慢半拍",
        "breath": "平稳",
        "mood": "问句多于陈述的冷静"
      }
    },
    {
      "name": "黑衣男",
      "nn": 3,
      "tier": "extra",
      "speaks": false,
      "evidence": [
        "黑衣男冲出来，手里一把折叠刀"
      ],
      "proposal": [
        "黑色连帽衫兜帽压低，口罩"
      ],
      "anchors": [
        "黑色连帽衫",
        "口罩",
        "手背刺青"
      ],
      "variants": [
        {
          "label": "连帽衫",
          "kind": "base",
          "costume": "黑色连帽衫，黑口罩，黑裤",
          "lock_card": [
            "黑色连帽衫兜帽压低",
            "黑口罩",
            "右手背刺青",
            "黑裤黑鞋"
          ],
          "sheet": "素材库/人物/黑衣男_三视图.png",
          "crops": [
            "素材库/人物/黑衣男_全身正面.png"
          ],
          "checked": true
        }
      ]
    }
  ],
  "props": [
    {
      "name": "病历夹",
      "category": "场景道具",
      "holder": "林小满",
      "evidence": [
        "抱着病历夹"
      ],
      "priority": 2,
      "image": "素材库/道具/病历夹.png",
      "checked": true
    },
    {
      "name": "折叠刀",
      "category": "武器",
      "holder": "黑衣男",
      "evidence": [
        "手里一把折叠刀"
      ],
      "priority": 3,
      "image": "素材库/道具/折叠刀.png",
      "states": [
        {
          "when": "E01S03B04",
          "desc": "掉在地上转半圈",
          "image": "素材库/道具/折叠刀_地上.png"
        }
      ],
      "checked": true
    }
  ],
  "locations": [
    {
      "name": "病房走廊",
      "space_type": "S3",
      "evidence": [
        "夜里的病房走廊，日光灯一盏接一盏"
      ],
      "plain_view": "站在走廊一端往里看，眼前是一条约三十米长的医院走廊，地面是浅绿色塑胶地板，反着头顶一排日光灯的冷白光。左手边隔四五米一扇病房门，门牌是蓝底白字的数字；右手边是护士站的矮柜台，柜台上一盏小台灯亮着暖光。再往里走廊变暗，尽头是两扇电梯门和旁边的楼梯间防火门。光从头顶日光灯直落，越往尽头越暗。",
      "depth": "近：塑胶地板与第一扇门；中：护士站矮柜台与台灯；远：电梯门与防火门",
      "light_source": "头顶日光灯冷白直落；护士站台灯暖光",
      "anchors": [
        "七床门",
        "护士站柜台",
        "台灯",
        "走廊尽头"
      ],
      "plate": "素材库/场景/病房走廊_夜_空景.png",
      "side_a": "素材库/场景/病房走廊_夜_A侧.png",
      "side_b": "素材库/场景/病房走廊_夜_B侧.png",
      "no_people_checked": true,
      "checked": true
    },
    {
      "name": "电梯口",
      "space_type": "S2",
      "evidence": [
        "走廊尽头，电梯门正在关上",
        "楼梯间防火门"
      ],
      "plain_view": "站在走廊尽头往回看，正对面是两扇不锈钢电梯门，门边的楼层指示灯亮着红色数字；电梯门左侧是一扇灰色楼梯间防火门，门上有一条竖长的小窗。头顶一盏日光灯坏了在闪，光忽明忽暗，不锈钢门面上映着走廊的倒影。地面还是浅绿塑胶地板，墙角有一个红色灭火器箱。",
      "depth": "近：地板与灭火器箱；中：电梯门与防火门；远：往回看的走廊",
      "light_source": "头顶一盏闪烁的日光灯；电梯指示灯红光",
      "anchors": [
        "电梯门",
        "防火门",
        "灭火器箱",
        "指示灯"
      ],
      "plate": "素材库/场景/电梯口_夜_空景.png",
      "side_a": "素材库/场景/电梯口_夜_A侧.png",
      "side_b": "素材库/场景/电梯口_夜_B侧.png",
      "no_people_checked": true,
      "checked": true
    }
  ],
  "screen_text": [
    {
      "who": "门牌",
      "text": "7",
      "when": "E01S01"
    }
  ],
  "plants": [
    {
      "id": "P1",
      "what": "周岸右手腕的留置针贴膏：他确实是七床，但不是来住院的",
      "scene": "E01S02",
      "shot_priority": "high"
    }
  ],
  "spatial_maps": [
    {
      "scene": "E01S02",
      "main_view": "从走廊看向电梯门",
      "map": "电梯门｜防火门\n  周岸（电梯门前）\n      ↑ 3 米\n  林小满（走廊侧）",
      "positions": [
        {
          "who": "周岸",
          "at": "电梯门",
          "meters": "距电梯门 0.5 米",
          "facing": "面向走廊（画面左）"
        },
        {
          "who": "林小满",
          "at": "走廊尽头",
          "meters": "距周岸 3 米",
          "facing": "面向电梯门（画面右）"
        }
      ],
      "cameras": [
        {
          "shot": "正反打 A",
          "side": "林小满右后侧，看周岸",
          "plate": "素材库/场景/电梯口_夜_A侧.png"
        },
        {
          "shot": "正反打 B",
          "side": "周岸左后侧，看林小满",
          "plate": "素材库/场景/电梯口_夜_B侧.png"
        }
      ],
      "gaze": "拍周岸时他朝画面左看；拍林小满时她朝画面右看",
      "approved": true
    },
    {
      "scene": "E01S03",
      "main_view": "从走廊看向电梯门",
      "map": "电梯门｜防火门（黑衣男冲出）\n  周岸 → 林小满被拨到身后\n  走廊",
      "positions": [
        {
          "who": "黑衣男",
          "at": "防火门",
          "meters": "从门口冲出 2 米",
          "facing": "面向周岸（画面左下）"
        },
        {
          "who": "周岸",
          "at": "电梯门",
          "meters": "距防火门 2 米",
          "facing": "面向防火门（画面右）"
        },
        {
          "who": "林小满",
          "at": "走廊尽头",
          "meters": "周岸身后 1 米",
          "facing": "面向防火门"
        }
      ],
      "cameras": [
        {
          "shot": "动作主机位",
          "side": "林小满一侧，过她肩看两人",
          "plate": "素材库/场景/电梯口_夜_A侧.png"
        }
      ],
      "approved": true
    }
  ],
  "style_anchor": {
    "art_style": "真人剧写实",
    "render_quality": "电影机定焦，胶片颗粒",
    "era": "当代",
    "genre": "夜班惊悚短剧"
  }
}